{
  "schema_version": 2,
  "dataset_version": "examples-v2",
  "kind": "examples",
  "files": {
    "clips.jsonl": "fa9cfc0b86361d6f752f8f5ddd84e42e95d8f9f3575e1ddd59d1cd108a53b6d1",
    "annotations.jsonl": "e72043da0b225e7fd8611c9b8f15701e61c445c3c036374ec09591d231836974",
    "adjudications.jsonl": "745c4979c0933a84ef9fc700e62162f3eaef05ec43c440216749328ef8b8bc61"
  }
}
