{
  "schema_version": 2,
  "dataset_version": "res01-review-2026-10-04",
  "kind": "draft",
  "limitations": [
    "Review revision of res06-draft-2026-10-02; not a frozen or rights-cleared corpus.",
    "Original clips, 259 source occurrences, authorship and 7 dev / 4 test split remain byte-for-byte unchanged.",
    "User confirmed no on-screen claims for clip-d and clip-k; clip-i final claims have spoken and on-screen-caption modalities.",
    "Clip-m is a user-confirmed negative recorded in main-arguments.jsonl; language applicability and archival rights remain unresolved. Historical provisional passes are not relabeled.",
    "All eight supplied card subjects and 20 occurrences reconciled to six screenshot hashes and existing user intervals. No speech timings substituted for visibility.",
    "Wage-theft opening meme visual quantities are unsupplied; AP secondary box at 20-23 s and EPI annual-growth inset at 73-80 s remain unreadable. No unseen assertions were invented.",
    "User confirmed all six social captions; separate reviewed SRTs remain in controlled storage. Claim-specific speech interval reconciliation is not included in this revision.",
    "Fine-grained media/caption visibility alignment remains unmeasured. Geoengineering source subtitles have twelve 1 ms adjacent-cue overlaps; these are disclosed, not a reason to request manual retiming.",
    "Additional scenarios are outside the user's fixed eleven-clip scope and must be reported as not evaluated. The full frozen coverage contract has not yet been revised.",
    "Rights evidence and credits remain pending. No redistribution or hosted processing permission is granted."
  ],
  "files": {
    "clips.jsonl": "3bc5291a74a55403f3047f2ebf1a86d9437083f40a64ea18c6826565c309cbaf",
    "annotations.jsonl": "9cfcd5f15dde0f3854a26266426054bc2e6be6a5c2fb344dc2d5c40e32481a3a",
    "adjudications.jsonl": "e1dc4d693e323e68e3bf74e18058f20aa45f2a4bb84e97ac28c6c2de6db46cd1",
    "main-arguments.jsonl": "1dd925da50330581536c2ab945a06d15387823d8149d8540a7412ac77b87773f"
  }
}
